{
  "dataset_name": "retention.sh Profile Edit Flow — Trajectory + Learning Package",
  "dataset_version": "1.0.0",
  "domain": ["mobile_qa"],
  "workflow_families": ["profile_edit", "navigation", "form_fill", "persistence_verification"],
  "collection_process": {
    "method": "agent_exploration",
    "source": "staging",
    "agent_runtime": "claude_code",
    "model_used": "claude-opus-4-6",
    "collection_period": {
      "start": "2026-03-10",
      "end": "2026-03-29"
    },
    "total_runs": 45,
    "total_trajectories": 3,
    "total_steps": 540,
    "total_tokens": 15000000
  },
  "review_process": {
    "human_reviewed": true,
    "machine_reviewed": true,
    "review_coverage_pct": 85,
    "inter_annotator_agreement": 0.92,
    "review_methodology": "Dual review: automated checkpoint validation + human audit of optimization candidates and policy labels"
  },
  "pii_status": "redacted",
  "pii_types_present": ["display_names", "profile_urls"],
  "data_type": "real",
  "licensing": {
    "license": "proprietary",
    "attribution_required": false,
    "commercial_use_allowed": false,
    "modification_allowed": false
  },
  "intended_uses": [
    "Workflow replay and rerun optimization",
    "Trajectory compression and shortcut validation",
    "Internal benchmark evaluation",
    "Vertical model fine-tuning for mobile QA workflows",
    "Reward modeling for replay-vs-explore policy optimization"
  ],
  "prohibited_uses": [
    "Training models to automate actions on Instagram without authorization",
    "Extracting or reconstructing user PII from trajectories",
    "Selling or distributing raw trajectory data to third parties",
    "Using data to bypass app security measures or rate limits"
  ],
  "known_limitations": [
    "Data collected on single device config (Pixel 8, API 35) — may not generalize to all Android devices",
    "Instagram app version 345.x — UI elements may change in future versions",
    "English locale only — other locales may have different element selectors",
    "Toast timing variability (800-2200ms) may cause drift on slower devices"
  ],
  "risks": [
    "Trajectory shortcuts may become invalid after Instagram UI updates",
    "Overfitting to specific device/OS/locale combination",
    "Drift score may underestimate real-world UI variability"
  ],
  "contact": "retention@retention.com",
  "created_at": "2026-03-29T22:05:00Z",
  "updated_at": "2026-03-29T22:05:00Z"
}
